Ulasan,Sentimen
badan cm bagus nyaman adem bikin gerah,Positif
ukur bahan nya bagus next beli lagi,Positif
ukur badan cm,Positif
ukur bad sesuai deskripsi barang kosong bantu proses refundnya jual,Positif
ukur badan cm,Positif
ukur sesuai keren banget model kini respon cepat kirim lancar jaya,Positif
ukur badan cm berat badan kg,Positif
baguss dehh murah pulak kecewaa bahan alus nyesel beli huhuhu,Positif
ukur badan cm bahan bagud nyaman dupakai,Positif
bjus nya bagus panas bahan adem banget baju nya simpel cntik banget,Positif
sukak and worty to buy,Positif
bb tb xl bgs,Positif
udah langgan beli hana fashion bagus bahan nya adem murah klo banyakin disc nya,Positif
baju bagus kirim cepat terimakasih,Positif
bagus bahan adem trs mulur makasih reseller,Positif
bahan adem ukur sesuai deskripsi thanks,Positif
kain tipis baju press body lebih oke jalan jalan santai,Positif
pesan warna hitam putih kirim nya hitam untung model cantik jahit rapi ukur cocoke badan tks ya next teliti ya,Positif
gemaaaasss bb banget kalo longgar pilih uk l,Positif
bahan bagus nyaman pakai harga jangkau,Positif
mantap bahan bagus nyaman banget pakai jahit rapi suka banget terima kasih,Positif
bahan bagus jahit rapi harga oke banget kirim aman,Positif
sesuai deskripsi jahit rapi respon jual oke kirim cepat,Positif
bagus harga muraah kualitas lumayan jalan,Positif
bagus poko tdak mngecewakan,Positif
bahan halus cantik,Positif
ukur bagus bahan,Positif
bahan sifon tipis panas mahal bahan keq gin harga tera,Netral
sesuai foto,Positif
cardigannya bagus banget kirim cepat trimakasih,Positif
bagus bahan jatoh cm depan sih gantung tarik dada,Positif
over all okee cumaa jahit rapi udah beli keduaaa kali nyaaa,Positif
beli lagiiii puasss banget,Positif
udah pesan x keren,Positif
ukur l badan sesuai deskripsi bahan halus jahit rapi suka banget,Positif
ukur longgar sih tb bb bahan tipis jaitan rapi dipakenya nyaman admin responsif bany,Positif
produk oke sesuai deskripsi enak pakai harga jangkau jual cepat response barang sesuai pesan jahit rapi kirim cepat packingan rapi,Positif
sesuai harga kualitas oke banget klo perlu dadak butuh baju sesuai dress code anak hrs pakai baju merah jahit rapi pokok sesuai,Positif
puas banget bahan bagus warna sesuai jahit rapi ukur jg,Positif
suka banget model simple kesan elegan beli warna,Positif
